	Kết nối khác	Cổng sạc	Camera sau	Độ phân giải	Chất liệu	Phụ kiện đi kèm	Băng tần 3G	Model	Chức năng khác	Thương hiệu	Jack tai nghe	Xuất xứ thương hiệu	Có thuế VAT	Trọng lượng	Kích thước màn hình	Loại Sim	FM radio	Băng tần 2G	Loại/ Công nghệ màn hình	Tên sản phẩm	Hỗ trợ thẻ tối đa	Xuất xứ	Thời gian sạc	Tốc độ CPU	Camera trước	Mã part	Chip đồ họa (GPU)	ROM	Đèn Flash	GPS	Quay phim	NFC	RAM	Bộ nhớ khả dụng	Nhà sản xuất	Xem phim	Loại pin	Kích thước	Video call	Wifi	Tính năng camera	Thời gian pin	Dung lượng pin	Số sim	Hỗ trợ 4G	Lưu ý	Nghe nhạc	Giá	Pin có thể tháo rời	Hỗ trợ 5G	Hỗ trợ thẻ nhớ ngoài	Chip set	Bluetooth	Ghi âm
0		Micro USB	13 MP	HD+ (700 x 1600 pixels)		Cáp, sạc, sách hướng dẫn		Redmi 9A		Xiaomi	3.5 mm	Trung Quốc	Có	194 g	6.53 inch	2 Nano SIM	Không		IPS LCD	Điện thoại Xiaomi Redmi 9A (2GB/32GB) - Hàng chính hãng	Hỗ trợ tối đa 512 GB	Trung Quốc		8 nhân 2.0 GHz	5 MP		PowerVR GE8320	32 GB	Có	BDS, A-GPS, GLONASS	Quay phim HD 720p@30fps, Quay phim FullHD 1080p@30fps		2 GB			Có	Pin chuẩn Li-Ion	Dài 164.9 mm - Ngang 77.07 mm - Dày 9 mm	Hỗ trợ VideoCall thông qua ứng dụng	Wi-Fi 802.11 b/g/n, Wi-Fi Direct, Wi-Fi hotspot	Xoá phông, A.I Camera, Tự động lấy nét (AF), Chạm lấy nét, Nhận diện khuôn mặt, HDR		5000 mAh		Có		Có	2190000	Pin liền		MicroSD		A2DP, LE	
1		USB Type-C	48.0 MP + 5.0 MP + 2.0 MP + 2.0 MP	HD+ (720 x 1600 pixels)		Sách hướng dẫn, cây lấy sim, cáp		M12		Samsung	3.5mm	Hàn Quốc			6.5 inch	SIM Nano			PLS TFT LCD	Điện Thoại Samsung Galaxy M12 (4GB/64GB) - Hàng Chính Hãng	Tối đa 1TB	Việt Nam/Ấn Độ/Trung Quốc (Tùy từng đợt nhập hàng)			8.0 MP			64GB	Có	GPS, Glonass, Beidou, Galileo	FHD (1920 x 1080)@30fps		4GB							802.11 b/g/n 2.4GHz			5000mAh	2	Có		Có	3890000			MicroSD	Exynos 850 (8 nhân)	Bluetooth v5.0	
2		Type-C		Full HD+ (1080 x 2400 Pixels)	Khung & Mặt lưng nhựa			M32		Samsung	3.5 mm		Có	196 g	6.4 inch	Nano	Không		Super AMOLED	Điện Thoại Samsung Galaxy M32 (8GB/128GB) - Hàng Chính Hãng - Đã kích hoạt bảo hành điện tử				2 nhân 2.0 GHz & 6 nhân 1.8 GHz													Li-Ion	Dài 160 mm - Ngang 74 mm - Dày 9 mm - Nặng 196 g						2				4660000				MediaTek Helio G80 8 nhân	A2DP  LE  v5.0	
3		Type - C	Bộ 3 Camera sau AI 48MP.	Full HD+ (1080 x 2400 Pixels)		Thiết bị | Bộ sạc | Cáp USB Type-C | Dụng cụ tháo SIM | Ốp bảo vệ | Hướng dẫn sử dụng nhanh | Thẻ bảo hành			Sạc pin nhanh	Xiaomi	3,5 mm		Có	190g	6.5 inch	2 Nano SIM	Không		IPS LCD	Điện thoại POCO M3 Pro 5G (6GB/128GB) - Hàng chính hãng				CPU tám lõi, lên đến 2,2 GHz	Camera trước 8MP.		Arm Mali-G57 MC2, Tần số GPU tối đa: 950MHz		Có	A-GPS  BDS  GALILEO  GLONASS	4K 2160p@30fps  FullHD 1080p@120fps  FullHD 1080p@30fps  FullHD 1080p@60fps	Có					Li-Po		Có	Wi-Fi 2,4GHz/5GHz	Bộ 3 Camera sau AI 48MP. Camera trước 8MP.		5000 mAh	2				5990000			có	MediaTek Dimensity 700	Bluetooth 5.1	Có
4										Samsung			Có							Điện thoại Samsung Galaxy M23 5G (6GB/128GB) - Hàng chính hãng																												4890000						
5	NFC	Type-C	Chính 64 MP & Phụ 12 MP, 5 MP, 5 MP	Full HD+ (1080 x 2400 Pixels)	Khung & Mặt lưng nhựa	Bộ sản phẩm gồm: Hộp, Sách hướng dẫn, Cây lấy sim, Cáp Type C, Củ sạc nhanh rời đầu Type A		Galaxy A52 (8GB/128GB)		Samsung	3.5mm	Hàn Quốc	Có	189 g	6.5 inch	Nano SIM	Có		Super AMOLED	Điện Thoại Samsung Galaxy A52 (8GB/128GB) - Hàng Chính Hãng	1TB	Hàn Quốc		2 nhân 2.3 GHz & 6 nhân 1.8 GHz	32MP		Adreno 618	128GB	Có	A-GPS, BDS, GALILEO ,GLONASS		Có	8GB	115 GB	Samsung	3GP, AVI, MP4, WMV	Li-Ion	Dài 159.9 mm - Ngang 75.1 mm - Dày 8.4 mm		Dual-band (2.4 GHz/5 GHz), Wi-Fi 802.11 a/b/g/n/ac, Wi-Fi Direct, Wi-Fi hotspot			4500 mAh	2	Có		AAC, AMR, FLAC, MP3, Midi, OGG, WAV, WMA	6790000			MicroSD	Snapdragon 720G 8 nhân	v5.0	Có
6	OTG	USB Type-C		Full HD+ (1080 x 2400 Pixels)	Khung nhôm & Mặt lưng nhựa	Hộp, Sạc, Sách hướng dẫn, Cây lấy sim, Cáp Type C		Galaxy S20 FE	Mở khoá vân tay dưới màn hình, Mở khoá khuôn mặt, Kháng nước, kháng bụi	Samsung	3.5mm		Có		6.5 inch	Nano Sim			Super AMOLED	Điện Thoại Samsung Galaxy S20 FE 256GB | 8GB - Hàng Chính Hãng 				1 nhân 2.84 GHz, 3 nhân 2.42 GHz & 4 nhân 1.8 GHz			Adreno 650	256 GB	Có	A-GPS, GALILEO, BDS, GLONASS	4K 2160p@60fps, 4K 2160p@30fps, FullHD 1080p@30fps, FullHD 1080p@60fps		8GB	221 GB			Li-Ion	Dài 159.8 mm - Ngang 74.5 mm - Dày 8.4 mm	Thông qua ứng dụng thứ 3	Wi-Fi 802.11 a/b/g/n/ac/ax, Wi-Fi MIMO, Wi-Fi hotspot, Dual-band (2.4 GHz/5 GHz), Wi-Fi Direct	Lấy nét theo pha (PDAF), Xoá phông, Zoom quang học, Chạm lấy nét, Toàn cảnh (Panorama), Chống rung quang học (OIS), Làm đẹp (Beautify), Tự động lấy nét (AF), Nhận diện khuôn mặt, HDR, Zoom kỹ thuật số, Góc rộng (Wide), Góc siêu rộng (Ultrawide)			2 (SIM 2 chung khe thẻ nhớ)			WMA, WAV, MP3	9490000			MicroSD	Snapdragon 865	V5.0	
7	NFC, OTG	Type-C	Chính 64 MP & Phụ 8 MP, 2 MP	Full HD+ (1080 x 2400 Pixels)	Khung & Mặt lưng nhựa	HDSD			Mở khoá vân tay dưới màn hình	OnePlus	3.5 mm	Trung Quốc		170 g	6.43 inch	Nano Sim			Fluid AMOLED	Điện Thoại OnePlus  Nord CE 5G (12GB/256G) - Hàng Chính Hãng		Trung Quốc		2 nhân 2.2 GHz & 6 nhân 1.8 GHz	16MP		Snapdragon 750G 5G	256GB		A-GPS,  BDS,  GALILEO,  GLONASS	4K 2160p@30fpsFullHD 1080p@120fps		12GB			Có	Li-Po	Dài 159.2 mm - Ngang 73.5 mm - Dày 7.9 mm -		Dual-band (2.4 GHz/5 GHz),  Wi-Fi 802.11 a/b/g/n/ac,  Wi-Fi Direct , Wi-Fi hotspot	Góc rộng (Wide)  Góc siêu rộng (Ultrawide),  HDR,  Lấy nét theo pha (PDAF),  Xóa phông		4500 mAh	2	Có		Có	7490000	Không			Snapdragon 750G 5G	A2DP,  LE,  v5.1	
8		Micro USB	13 MP	HD+ (700 x 1600 pixels)						OPPO	3.5 mm	Trung Quốc	Có	193g	6.52 inch	Nano SIM			IPS LCD	Điện Thoại Oppo A16k (3GB/32G) - Hàng Chính Hãng		Trung Quốc		4 nhân 2.3 GHz & 4 nhân 1.8 GHz	13 MP		IMG PowerVR GE8320	32 GB	Có	BDS,  GALILEO,  GLONASS	Có		3GB			Có	Li-Po	Dài 163.6 mm - Ngang 74 mm - Dày 8.3 mm		Có	HDR, Toàn cảnh (Panorama)		4230 mAh	2	Có		Có	2890000				MediaTek MT6765 8 nhân	A2DP,  apt-X,  LE,  v5.0	Có
9	OTG	USB Type-C	Chính 64 MP & Phụ 8 MP, 2 MP, 2 MP	Full HD+ (1080 x 2400 Pixels)				Oppo Reno 5	Chặn cuộc gọi, Đa cửa sổ (chia đôi màn hình), Nhân bản ứng dụng, Chặn tin nhắn	OPPO	Type-C	Trung Quốc		171g (Bao gồm pin)	6.43 inch	Nano SIM			AMOLED, 90Hz, Gorilla Glass 3+	Điện Thoại Oppo Reno 5 (8GB/128G) - Hàng Chính Hãng		Trung Quốc		tối đa 2.3GHz	32 MP		Adreno 620	128GB	Có	GLONASS, BDS, A-GPS	Có		8GB			Có	Li-Po	"159.1 x 73.3 x 7.7 mm (Đen)
159.1 x 73.3 x 7.8 mm (Bạc)"	Thông qua ứng dụng thứ 3	Wi-Fi 802.11 a/b/g/n/ac, Wi-Fi hotspot, Dual-band (2.4 GHz/5 GHz), Wi-Fi Direct	Lấy nét theo pha (PDAF), Trôi nhanh thời gian (Time Lapse), Quay chậm (Slow Motion), Xóa phông, Chạm lấy nét, Toàn cảnh (Panorama), Chống rung quang học (OIS), Làm đẹp (Beautify), Tự động lấy nét (AF), Nhận diện khuôn mặt, HDR, Chuyên nghiệp (Pro), Góc rộng (Wide), Góc siêu rộng (Ultrawide)		4310mAh (Typ)	2	Có		Có	5990000			Hỗ trợ thẻ nhớ tối đa 128GB	Qualcomm Snapdragon 720G	V 5.1	
10		Type C		Full HD+ (1080 x 2440 Pixels)		Điện Thoại + Bộ Cáp Sạc + Sách Hướng Dẫn		Pova2		Tecno	3.5mm		Có		6.9 inch	Nano	Không		Màn hình cảm ứng điện dung IPS LCD, 16 triệu màu	Tecno Pova 2 6GB l 128GB - Điện Thoại Thông Minh Chiến Game Cực Đỉnh - Hàng Chính Hãng	256GB		Sạc nhanh 18W - 100% trong 90p														Li-Po			Wi-Fi 802.11 a / b / g / n / ac, băng tần kép, Wi-Fi Direct, DLNA,		7000 mAh		02				3690000			Micro SD	MediaTek Helio G85	Bluetooth 5.0, A2DP, LE, aptX HD	
11	OTG	Type-C	Chính 50 MP & Phụ 2 MP, 2 MP	HD+ (700 x 1600 pixels)	Khung & Mặt lưng nhựa	Sạc, Sách HDSD			Mở khoá khuôn mặt, Mở khoá vân tay cạnh viền,  Ứng dụng kép (Nhân bản ứng dụng)	OPPO	3.5 mm	Trung Quốc	Có	193g	6.5 inch	Nano SIM			IPS LCD, Kính cường lực Dinorex Glass	Điện Thoại Oppo A55 (4GB/64GB) - Hàng Chính Hãng	Hỗ trợ tối đa 256 GB	Trung Quốc		4 nhân 2.3 GHz & 4 nhân 1.8 GHz	16 MP		IMG PowerVR GE8320	64 GB			FullHD 1080p@30fpsHD 720p@30fps		4GB				Li-Po	Dài 163.6 mm - Ngang 74 mm - Dày 8.3 mm		Dual-band (2.4 GHz/5 GHz),  Wi-Fi 802.11 a/b/g/n/ac,  Wi-Fi Direct,  Wi-Fi hotspot	AI Camera , Ban đêm (Night Mode)  ,Chuyên nghiệp (Pro) , Chạm lấy nét,  HDR  ,Làm đẹp,  Nhận diện khuôn mặt  ,Tự động lấy nét (AF) , Xóa phông		5000 mAh	2	Có			3990000			MicroSD	MediaTek Helio G35 8 nhân	Có	
12		Lightning	12 MP + 12 MP			Sách hướng dẫn		iPhone 12	Face ID	Apple	Lightning	Mỹ	Có	164g	6.1 inch	Nano Sim	Không		Super Retina XDR OLED, HDR10, Dolby Vision, Wide color gamut, True-tone	Apple iPhone 12		Trung Quốc			12 MP	VN/A	Apple GPU (4-core graphics)	64GB	Có				4GB			Có		146.7 x 71.5 x 7.4 mm	Hỗ trợ VideoCall thông qua ứng dụng	Có	4K@24/30/60fps, 1080p@30/60/120/240fps, HDR, Dolby Vision HDR (up to 30fps), stereo sound rec.			2 (nano‑SIM + eSIM)			Có	16290000				Apple A14 Bionic (5 nm)	Có	Có
13		Type-C	Chính 48 MP & Phụ 8 MP, 2 MP, 2 MP	Full HD+ (1080 x 2240 pixels)				A94		OPPO	3.5mm	Trung Quốc		175g	6.43 inch	2 Nano SIM			AMOLED	Điện Thoại Oppo A94 (8GB/128G) - Hàng Chính Hãng	256 GB	Trung Quốc		2 nhân 2.2 GHz & 6 nhân 2.0 GHz	32MP		IMG PowerVR GM9446	128 GB	Có		Có		8 GB			Có	Li-Po	Dài 164 mm - Ngang 75.4 mm - Dày 7.9 mm		Wi-Fi hotspot, Dual-band (2.4 GHz/5 GHz), Wi-Fi 802.11 a/b/g/n/ac,	A.I Camera, Ban đêm (Night Mode), Xóa phông, Chạm lấy nét, Toàn cảnh (Panorama), Tự động lấy nét (AF), Nhận diện khuôn mặt, HDR, Chuyên nghiệp (Pro), Làm đẹp, Góc rộng (Wide), Siêu cận (Macro), Góc siêu rộng (Ultrawide)		4310 mAh	2			Có	5150000	Pin liền		Micro SD	MediaTek Helio P95 8 nhân	A2DP, LE, v5.1, apt-X	
14		Type-C	Chính 64 MP & Phụ 8 MP, 5 MP	Full HD+ (1080 x 2400 Pixels)		Hộp, Sách hướng dẫn, Cây lấy sim, Ốp lưng, Cáp Type C, Củ sạc nhanh rời đầu Type A				Xiaomi	Type-C	Trung Quốc		158 g	6.55 inch	Nano SIM			Kính cường lực Corning Gorilla Glass 5	Điện thoại Xiaomi 11 Lite 5G NE (6GB/128GB) - Hàng chính hãng		Trung Quốc		1 nhân 2.4 GHz, 3 nhân 2.2 GHz & 4 nhân 1.9 GHz	20 MP		Adreno 642L	128GB			4K 2160p@30fps,  FullHD 1080p@30fps,  FullHD 1080p@60fps		6GB			Có	Li-Po	160.5 mm x 75.7 mm  x 6.8 mm		Wi-Fi hotspot,  Wi-Fi 802.11 a/b/g/n/ac/ax,  Wi-Fi Direct,  Dual-band (2.4 GHz/5 GHz)	HDR,  Góc siêu rộng (Ultrawide), Góc rộng (Wide), Lấy nét theo pha (PDAF), Xóa phông, Toàn cảnh (Panorama)		4250 mAh	2 Nano SIM			Có	7250000	Pin liền		MicroSD	Snapdragon 778G 5G 8 nhân	A2DP,  LE,  v5.2	
15										Samsung			Có							Điện thoại Samsung Galaxy A53 5G (8GB/128GB) - Hàng chính hãng																												9290000						
16		Micro USB	Chính 13 MP & Phụ 2 MP	HD+ (720 x 1600 pixels)		Sách hướng dẫn, cây lấy sim, cáp				Nokia	3.5 mm	Trung Quốc		237 g		Nano SIM			IPS LCD	Điện Thoại Nokia C30 (2GB/32GB) - Hàng Chính Hãng	256 GB	Trung Quốc		4 nhân 1.6 GHz & 4 nhân 1.2 GHz	5 MP		IMG PowerVR 8322	32GB	Có	A-GPS	FullHD 1080p@30fps, HD 720p@30fps		2GB			MP4	Li-Po	Dài 177.7 mm - Ngang 79.1 mm - Dày 9.9 mm		Wi-Fi 802.11 a/b/g/n, Wi-Fi hotspot	Chạm lấy nét,  HDR,  Làm đẹp  Nhận diện khuôn mặt,  Toàn cảnh (Panorama),  Tự động lấy nét (AF),  Xóa phông		6000 mAh	2	Có		MP3, WAV	2090000			MicroSD	Spreadtrum SC9863A 8 nhân	A2DP, v4.2	
17	OTG	Micro USB	Chính 13 MP & Phụ 2 MP	HD+ (720 x 1600 pixels)		Sách hướng dẫn, cây lấy sim, cáp microUSB, Củ sạc nhanh rời đầu Type A			Mở khoá khuôn mặt, Mở khoá vân tay cạnh viền	Vivo		Trung Quốc		Nặng 191 g	6.5 inch	Nano SIM	Có		IPS LCD	Điện thoại di động Vivo Y21s (4GB/128GB) - Hàng chính hãng	256 GB	Trung Quốc		4 nhân 2.3 GHz & 4 nhân 1.8 GHz	8 MP		IMG PowerVR GE8320	128GB	Có	A-GPS,  BDS,  GALILEO,  GLONASS	FullHD 1080p@30fps, HD 720p@30fps		4GB	120 GB		3GP,  AVI , MP4	Li-Po	Dài 164.41 mm - Ngang 76.32 mm - Dày 8.41 mm		Dual-band (2.4 GHz/5 GHz),  Wi-Fi 802.11 a/b/g/n/ac, Wi-Fi hotspot	Chuyên nghiệp (Pro) , Chạm lấy nét , Làm đẹp,  Nhận diện khuôn mặt , Toàn cảnh (Panorama) , Trôi nhanh thời gian (Time Lapse),  Tự động lấy nét (AF),  Xóa phông		5000 mAh	2	Có		FLAC,  MP3,  Midi, WAV	3890000			MicroSD	MediaTek Helio P35 8 nhân	v5.0	Có
18										Samsung			Có							Điện thoại Samsung Galaxy A23 (4GB/128GB) - Hàng chính hãng																												4890000						
19			Chính 64 MP & Phụ 8 MP, 2 MP			Sách hướng dẫn				OPPO		Trung Quốc		193g	6.43 inch				AMOLED	Điện Thoại Oppo Reno 6Z 5G (8GB/128G) - Hàng Chính Hãng		Trung Quốc			32 MP		Mali-G57 MC3	128GB					8GB					Dài 163.6 mm - Ngang 74 mm - Dày 8.3 mm		Có			4310mAh		Có			6290000				MTK Dimensity 800U 5G, tối đa 2.4G	Có	
20										Samsung			Có							Điện thoại Samsung Galaxy A13 (4GB/128GB) - Hàng chính hãng																												3990000						
21	Bluetooth, GPS, Wifi	Micro USB	5 MP	HD+ (720 x 1440 pixels)	Khung & Mặt lưng nhựa	Bộ sản phẩm bao gồm: Thân máy, cáp micro USB, sạc, tai nghe, ốp silicon, sách hướng dẫn sử dụng.		Nokia C01 Plus 2GB/16GB	Radio, Xem phim, Nghe nhạc	Nokia	3.5 mm		Có	157 g	5.45 inch	2 Nano SIM	Không		IPS LCD	Điện Thoại Nokia C01 Plus 2GB/16GB - Hàng Chính Hãng	Hỗ trợ tối đa 128 GB			Spreadtrum SC9863A 8 nhân	5 MP		Mali-G52 MC2	16GB			HD 720p@30fps		2GB	RAM:2 GB ROM:16 GB		Có	Li-Ion	Dài 148 mm - Ngang 71.8 mm - Dày 9.3 mm - Nặng 157 g		Wi-Fi 802.11 a/b/g/nWi-Fi hotspot			3000 mAh	2			Có	1609000	Có		MicroSD	Spreadtrum SC9863A 8 nhân	A2DP  LE  v4.2	
22		Type-C		Full HD+ (1080 x 2400 Pixels)	Khung nhựa & Mặt lưng nhựa giả kính			2201117TG (4GB/64GB)		Xiaomi	3.5 mm		Có	179 g	6.43 inch	Nano SIM			AMOLED	Điện thoại Xiaomi Redmi Note 11 (4GB/64GB) - Hàng chính hãng	1 TB			8 nhân 2.4 GHz										54 GB			Li-Po			Wi-Fi 802.11 a/b/g/n/ac , Wi-Fi Direct				2				4290000			MicroSD	Snapdragon 680 8 nhân	v5.0	
23			13 MP	HD+ (720 x 1600 pixels)		Sách hướng dẫn		A16k (4GB/64G)		OPPO		Trung Quốc		193g		Nano Sim			Corning Gorilla Glass 3	Điện Thoại Oppo A16k (4GB/64G) - Hàng Chính Hãng		Trung Quốc		Tối đa 2.3GHz	5 MP		IMG GE8320	64GB	Có		FullHD 1080p@30fpsHD 720p@30fps		4GB			Có		164 x 75.4 x 7.85 mm		2.4G/5G, 802.11 a/b/g/n/ac			4230mAh	2			Có	3350000			Có	Helio G35 8 nhân, tối đa 2.3GHz	v5.0	
24	OTG	Type-C	Chính 48 MP & Phụ 2 MP, 2 MP	Full HD+ (1080 x 2400 Pixels)	Khung & Mặt lưng thủy tinh hữu cơ				Mở khoá khuôn mặt, Mở khoá vân tay dưới màn hình	OPPO	3.5 mm	Trung Quốc		193g	6.43 inch	Nano SIM			AMOLED	Điện Thoại Oppo A95 (8GB/128G) - Hàng Chính Hãng	256GB	Trung Quốc		4 nhân 2.0 GHz & 4 nhân 1.8 GHz	16 MP		Adreno 610	128 GB	Có	BDS,  GALILEO,  GLONASS,  GPS	FullHD 1080p@30fps, HD 720p@30fps		8GB	Khoảng 115 GB		AVI, MP4	Li-Po	Dài 163.6 mm - Ngang 74 mm - Dày 8.3 mm		Dual-band (2.4 GHz/5 GHz),  Wi-Fi 802.11 a/b/g/n/ac,  Wi-Fi Direct,  Wi-Fi hotspot	AI Camera,  Chuyên nghiệp (Pro),  HDR,  Lấy nét theo pha (PDAF),  Siêu cận (Macro),  Toàn cảnh (Panorama),  Trôi nhanh thời gian (Time Lapse),  Xóa phông		5000 mAh	2	Có		FLAC,  Midi , MP3,  OGG	5950000			MicroSD	Snapdragon 662 8 nhân	A2DP,  LE,  v5.0	Có
25		Type-C	Standard: 48.0 MP; Macro lens: 2.0 MP; Depth: 2.0 MP	Full HD+ (1080 x 2400 Pixels)				A74		OPPO	Jack 3.5 mm	Trung Quốc		193g	6.43 inch	Nano SIM	Có		AMOLED	Điện Thoại Oppo A74 (8GB/128G) - Hàng Chính Hãng	256 GB	Trung Quốc		2.0 GHz	16.0 MP		Adreno 610	128 GB		Có			8 GB				Lithium polymer	Dài 163.6 mm - Ngang 74 mm - Dày 8.3 mm		Wi-Fi 802.11 a/b/g/n/ac, Dual-band, Wi-Fi hotspot	Chụp đêm; A.I Camera; Chụp góc rộng; Chế độ làm đẹp; Tự động lấy nét; Chụp xóa phông; Lấy nét laser; Chụp chân dung; Panorama; HDR; Lấy nét theo pha; Time Lapse; Quay Slow Motion; Gắn thẻ ảnh địa lý; Phát hiện khuôn mặt		5000 mAh	2	Có			5190000			MicroSD	Snapdragon 662 Octa-Core 8 nhân	v5.0	
26										Samsung			Có							Điện thoại Samsung Galaxy S22 Ultra (8GB/128GB) - Đã kích hoạt bảo hành - Hàng chính hãng																												24990000						
27		Micro USB		720 x 1440 pixels				Nokia C01 plus		Nokia	3.5 mm		Có	157 g	5.45 inch	Nano			IPS LCD	Điện thoại Nokia C01 Plus (2GB/16GB) - Hàng chính hãng	128 GB			4 nhân 1.6 GHz & 4 nhân 1.2 GHz														Dài 148 mm - Ngang 71.8 mm - Dày 9.3 mm - Nặng 157 g		Wi-Fi 802.11 a/b/g/nWi-Fi hotspot				2				1710000				Spreadtrum SC9863A 8 nhân	A2DP  LE  v4.2	
28		Micro USB						Realme Narzo 50i		Realme	3.5mm		Có	195 g	6.5 inch	Nano			IPS LCD	Điện thoại Realme Narzo 50i (4GB/64GB) - Hàng chính hãng				1.6 GHz																Wi-Fi 802.11 a/b/g/nWi-Fi hotspot				2				2690000				CPU 8 nhân	A2DP  LE  v4.2	
29		Type-C		Full HD+ (1080 x 2400 Pixels)	Khung kim loại & Mặt lưng nhựa	Hộp, Sách hướng dẫn, Cây lấy sim, Ốp lưng, Cáp Type C, Củ sạc nhanh rời đầu Type A		Note 10s	Mở khoá khuôn mặtMở khoá vân tay cạnh viền	Xiaomi	3.5 mm		Có	178.8 g	6.43 inch	Nano SIM	Không		AMOLED	Điện thoại Xiaomi Redmi Note 10S (8GB/128GB) - Hàng chính hãng 	1 TB			2 nhân 2.05 GHz & 6 nhân 2.0 GHz										115 GB			Li-Po	Dài 160.5 mm - Ngang 74.5 mm - Dày 8.3 mm		Dual-band (2.4 GHz/5 GHz)  Wi-Fi 802.11 a/b/g/n/ac  Wi-Fi Direct  Wi-Fi hotspot				2				5590000			MicroSD	MediaTek Helio G95	A2DP  LE  v5.1	
30	GSM/GPRS/EDGE/HSPA+/WCDMA/LTE	Micro USB		HD+ (720 x 1520 Pixels)	Khung và vỏ nhựa	Bộ sản phẩm gồm: Hộp, điện thoại, Thẻ bảo hành, Củ sạc, Dây sạc Tai nghe, Ốp lưng		A26	GPS	Itel	3.5mm	Trung Quốc	Có	168g	5.7 inch	Nano SIM			IPS LCD	"Điện thoại thông minh itel A26  2 Sim 2 Sóng 4G LTE - Màn hình IPS 5.7"" - RAM 2GB + ROM 32 GB - Mở khoá bằng Gương Mặt -  Hàng chính hãng "	128GB	Trung Quốc	2-3h	Quad-core ARM CortexTM A53 1.4GHz			Single-coreARM mali820 as 3D graphics accelerator	32 GB	Có	Có	Có		2 GB	2GB+32GB		3GP, MP4, AVI	Lithium Ion	148*72.3*9.9mm	Có	Có	Front(2M FF))/Rear(5M AF+0.08M)	"Thời gian thoại: 2G:16H; 3G：14H
Thời gian chờ: 2G: 650H; 3G: 560H; 4G: 500H"	2950mAh/3020mAh（min/typ）	Dual SIM	Có	Bảo hành chính hãng 12 tháng, 1 đổi 1 trong vòng 30 ngày do lỗi sản xuất.	MP3, MIDI, AAC, WAV	1990000	Có	Không	Micro SD	Spreadtrum SC9832E	v4.2	Có
31						Nokia C30Sách HDSD nhanhSạcCáp USB MicroỐp siliconMiếng dán màn hìnhTai nghe				Nokia			Có				Có			Điện thoại Nokia C30 2GB/32GB - Hàng chính hãng								2GB					32GB	2GB								3 ngày (tùy theo thời lượng người dùng).						2090000						
32										Samsung			Có							Điện thoại Samsung M33 5G (8Gb/128GB) - Hàng chính hãng																												5790000						
33		Type-C		HD+ (700 x 1600 pixels)	Khung & Mặt lưng nhựa	Bộ sản phẩm gồm: Hộp, Sách hướng dẫn, Cây lấy sim, Cáp Type C, Củ sạc nhanh rời đầu Type A		Điện thoại Samsung Galaxy A12 6GB (2021)	Mở khoá khuôn mặtMở khoá vân tay cạnh viền	Samsung	3.5mm		Có	Nặng 205 g	6.5 inch	Nano			PLS TFT LCD	Điện thoại Samsung Galaxy A12 6GB (2021)	hỗ trợ tối đa 1 TB			8 nhân 2.0 GHz			Mali-G52	128 GB	Có		Có		6 GB	107 GB		Có	Li-ion	Dài 164 mm - Ngang 75.8 mm - Dày 8.9 mm - Nặng 205 g	Có	Wi-Fi 802.11 a/b/g/nWi-Fi hotspot	Chạm lấy nét  Góc rộng (Wide)  Góc siêu rộng (Ultrawide)  HDR  Làm đẹp  Nhận diện khuôn mặt  Siêu cận (Macro)  Tự động lấy nét (AF)  Xóa phông  Zoom kỹ thuật số		5000 mAh	2	Có		Có	3890000	Không		MicroSD	Exynos 850 8 nhân	v5.0	Có
34	NFC	Lightning	3 camera 12 MP	1284 x 2778 pixels	Khung thép không gỉ & Mặt lưng kính cường lực			iPhone 13 Pro Max 128GB		Apple	Lightning	Mỹ		228g	6.7 inch	Nano SIM & eSIM			OLED, Tần số quét 120 Hz, Kính cường lực Ceramic Shield	Apple iPhone 13 Pro Max		Trung Quốc		3.22 GHz	12MP		Apple GPU 5 nhân	128GB		A-GPS,  BDS,  GALILEO,  GLONASS,  iBeacon,  QZSS	4K 2160p@24fps,  4K 2160p@30fps,  4K 2160p@60fps,  FullHD 1080p@120fps,  FullHD 1080p@240fps,  FullHD 1080p@30fps,  FullHD 1080p@60fps,  HD 720p@30fps		6GB			Có	Li-Ion	160.8 x 78.1 x 7.4 mm		Wifi 6	Ban đêm (Night Mode), Chạm lấy nét,  Chống rung quang học (OIS),  Dolby Vision HDR,  Góc rộng (Wide),  Góc siêu rộng (Ultrawide),  HDR  Nhận diện khuôn mặt  Quay chậm (Slow Motion),  Siêu cận (Macro),  Toàn cảnh (Panorama),  Trôi nhanh thời gian (Time Lapse),  Tự động lấy nét (AF),  Xóa phông,  Zoom kỹ thuật số,  Zoom quang học,  Ảnh Raw		4352 mAh	1 Nano SIM & 1 eSIM	Có		Có	29490000	Pin liền			Chip A15 Bionic (5nm)	Có	
35		Type-C		Full HD+ (1080 x 2340 Pixels)				S22		Samsung	Type C		Có		6.1 inch					Điện thoại Samsung Galaxy S22 5G (8GB/256GB) - Hàng chính hãng				Dynamic AMOLED 2X				256GB					8GB								AI Camera Ban đêm (Night Mode) Chống rung quang học (OIS) Góc siêu rộng (Ultrawide) HDR Toàn cảnh (Panorama) Xóa phông Zoom kỹ thuật số Zoom quang học		3700 mAh					16990000		Có		Snapdragon 8 Gen 1 8 nhân		
36		microUSB 2.0	48 MP, AF	HD+ (720 x 1600 pixels)				Spark 7T		Tecno	3.5mm		Có		6.52 inch	Nano	Không		IPS LCD	Điện Thoại TECNO Spark 7T (KF6P) 4GB/64GB - Camera 48MP | 6000 mAh | Helio G35 | Hàng Chính Hãng - Hàng Chính Hãng					8 MP			64GB			1080p@30fps		4GB				Li-Po						Li-Po 6000 mAh	2				2790000				MediaTek MT6765G Helio G35 (12 nm)		
37	OTG	Type-C	Chính 50 MP & Phụ 2 MP, 2 MP	HD+ (720 x 1600 pixels)		Sách hướng dẫn, cây lấy sim, cáp				Nokia	3.5mm	Phần Lan			6.5 inch	Nano SIM			TFT LCD	Điện Thoại Nokia G21 (4GB/128GB) - Hàng Chính Hãng	256GB	Trung Quốc		1.6 Ghz	8MP		Mali-G57	128 GB	Có	GALILEO,  GLONASS,  GPS	FullHD 1080p@30fps, HD 720p@30fps	Có	4GB	115GB		AVI, MP4	Li-Ion	Dài 164.6 mm - Ngang 75.9 mm - Dày 8.5 mm - Nặng 190 g		Dual-band (2.4 GHz/5 GHz), Wi-Fi 802.11 a/b/g/n/ac	Ban đêm (Night Mode), HDR, Làm đẹp, Siêu cận (Macro), Toàn cảnh (Panorama), Trôi nhanh thời gian (Time Lapse), Xóa phông		5050 mAh	2			FLAC,  Midi , MP3,  OGG	3650000			MicroSD	Unisoc T606 8 nhân	v5.0	
38			48MP + 5MP + 2MP + 2MP			Sách hướng dẫn, cây lấy sim, cáp		M12		Samsung		Hàn Quốc			6.5 inch					Điện Thoại Samsung Galaxy M12 (3GB/32GB) - Hàng Chính Hãng	1TB	Việt Nam			8MP			32GB	Có		Có		3GB			Có				Có			5000mAh		Có		Có	2799000			Có		Có	
39		Type-C				Bộ sản phẩm bao gồm: Thân máy, cáp USB TypeC, sạc, tai nghe, ốp lưng, sách hướng dẫn sử dụng.				Nokia	3.5 mm		Có	194g	6.5 inch	Nano Sim			IPS LCD	Điện Thoại Nokia G10 4GB/64GB - Hàng Chính Hãng								64GB					4GB					Dài 164.9 mm - Ngang 76 mm - Dày 9.2 mm - Nặng 194 g						2			FLAC, Midi, OGG	2889000						
40		Micro USB		HD+ (720 x 1600 pixels)	Khung & Mặt lưng nhựa Polycarbonate	"Điện Thoại Nokia C20 2GB/32GB - Hàng Chính Hãng
Bộ sản phẩm bao gồm: Thân máy, cáp micro USB, sạc, tai nghe, ốp silicon, sách hướng dẫn sử dụng."		C20 2GB/32GB		Nokia	3.5 mm		Có	191g	6.5 inch	Li-Ion			IPS LCD	Điện Thoại Nokia C20 2GB/32GB - Hàng Chính Hãng	MicroSD, hỗ trợ tối đa 256 GB			4 nhân 1.6 GHz & 4 nhân 1.2 GHz														"Kích thước, khối lượng:

Dài 169.9 mm - Ngang 77.9 mm - Dày 8.8 mm - Nặng 191 g"		Wi-Fi hotspot, Wi-Fi 802.11 a/b/g/n				2				1890000	Pin rời		Tối đa 256 GB	Spreadtrum SC9863A 8 nhân	A2DP, v4.2	
41						Gói bán hàng Nokia C01 Plus gồm có:Nokia C01 PlusCáp Micro USBSạcSách HDSD nhanhỐp siliconTai nghe				Nokia			Có							Điện thoại Nokia C01 Plus - Hàng chính hãng								16GB					2GB										3000 mAh					1649000						
42		Type C	Chính 13 MP & Phụ 2 MP, 2 MP			Điện thoại, Củ sạc, Cáp sạc, Sách hướng dẫn, khe chọc sim.		Redmi 9C	Đèn pin, Chạm 2 lần sáng màn hình, Chạm 2 lần tắt màn hình, Chặn cuộc gọi, Chặn tin nhắn, Thu nhỏ màn hình sử dụng một tay, Nhân bản ứng dụng, Khoá ứng dụng	Xiaomi	3.5mm	Trung Quốc		0.2		Nano sim			IPS LCD	Điện Thoại Xiaomi Redmi 9C - Hàng Chính Hãng	Hỗ trợ tối đa 512 GB	Trung Quốc		4 nhân 2.3 GHz & 4 nhân 1.8 GHz	5 MP						Quay phim HD 720p@30fps, Quay phim FullHD 1080p@30fps						Pin chuẩn Li-Ion			Wi-Fi 802.11 a/b/g/n, Wi-Fi Direct, Wi-Fi hotspot	Siêu cận (Macro), Làm đẹp, Xoá phông, A.I Camera, Tự động lấy nét (AF), Chạm lấy nét, Nhận diện khuôn mặt, HDR, Chuyên nghiệp (Pro)		5000 mAh	2				2650000			Micro SD	MediaTek Helio G35 8 nhân	LE, A2DP, v4.2	
43		Micro USB			Khung & Mặt lưng nhựa	"Điện Thoại Vsmart Bee Lite 2GB/16GB - Hàng Chính Hãng
Bộ sản phẩm bao gồm: Thân máy, sạc, cáp USB, sách hướng dẫn sử dụng."		Bee Lite 2GB/16GB		Vsmart	3.5 mm		Có		5.45 inch	Nano SIM				Điện Thoại Vsmart Bee Lite 2GB/16GB - Hàng Chính Hãng	Tối đa 64 GB			4 nhân 1.3 GHz																Wi-Fi 802.11 a/b/g/nWi-Fi hotspot				2				1479000			MicroSD	Snapdragon 215 4 nhân	v4.2	
